{
  "event_id": "demo-polycab-fy26",
  "entity_id": "nse-polycab",
  "detected_at": "2026-09-29T00:00:00Z",
  "changes": [
    {"field":"revenue","kind":"changed"},
    {"field":"pat","kind":"changed"},
    {"field":"roce","kind":"changed"},
    {"field":"net_cash","kind":"changed"}
  ],
  "materiality":"high",
  "status":"needs_red_team"
}
